"","version","query","location","paginationPayload","dupefilter","highlight","totalResults","start","end","pageNumber","results.jobtitle","results.company","results.city","results.state","results.country","results.formattedLocation","results.source","results.date","results.snippet","results.url","results.onmousedown","results.jobkey","results.sponsored","results.expired","results.indeedApply","results.formattedLocationFull","results.formattedRelativeTime","results.stations","status","period","currency","minSal","maxSal"
"290",2,"actuaria","","",TRUE,TRUE,421,276,300,11,"Analista de Investigacion de Mercados","ACH FOODS","Ciudad de México","DIF","MX","Ciudad de México, D. F.","Indeed","Thu, 08 Dec 2016 18:32:22 GMT","En <b>Actuaria</b>, Matematicas, administracion (Indispensable estar titulado). ACH Foods México....","http://www.indeed.com.mx/viewjob?jk=c033a69bf2e22316&qd=bi1irCVCGq9473EJ9E79kxCEXhjIMzb7lFAuRtDcUo_TcNKK_aY9kAcq4uhA63y4Wa7oCiuU6sncF-TpXaOJIR6nojn63AzuMLy1372sZMY&indpubnum=7697745275879740&atk=1b6vd5dvuah7o9os","indeed_clk(this,'7819');","c033a69bf2e22316",FALSE,FALSE,TRUE,"Ciudad de México, D. F.","hace 30+ días","","unknown","unknown","USD",13000,13000
"291",2,"actuaria","","",TRUE,TRUE,421,276,300,11,"Analista KPI","AN|Extend","Ciudad de México","DIF","MX","Ciudad de México, D. F.","Indeed","Mon, 05 Dec 2016 17:32:28 GMT","Ingeniería en Sistemas Computacionales, <b>Actuaría</b>, Ing. AN|Extend fue fundada el 24 de Agosto del 2004 con la finalidad de proveer servicios especializados en...","http://www.indeed.com.mx/viewjob?jk=0ef16be648243b46&qd=bi1irCVCGq9473EJ9E79kxCEXhjIMzb7lFAuRtDcUo_TcNKK_aY9kAcq4uhA63y4Wa7oCiuU6sncF-TpXaOJIR6nojn63AzuMLy1372sZMY&indpubnum=7697745275879740&atk=1b6vd5dvuah7o9os","indeed_clk(this,'7819');","0ef16be648243b46",FALSE,FALSE,TRUE,"Ciudad de México, D. F.","hace 30+ días","","unknown","unknown","USD",11000,11000
"292",2,"actuaria","","",TRUE,TRUE,421,276,300,11,"Asistente de Coordinación","Babel International Translators","Ciudad de México","DIF","MX","Ciudad de México, D. F.","Babel International Translators","Wed, 18 Jan 2017 23:40:13 GMT","Escolaridad mínima Licenciatura en el área matemática (Matemáticas, <b>Actuaría</b>, afin). BABEL INTERNATIONAL TRANSLATORS es una Agencia de Traducciones anglo...","http://www.indeed.com.mx/viewjob?jk=0b8cd3ab32f09e71&qd=bi1irCVCGq9473EJ9E79kxCEXhjIMzb7lFAuRtDcUo_TcNKK_aY9kAcq4uhA63y4Wa7oCiuU6sncF-TpXaOJIR6nojn63AzuMLy1372sZMY&indpubnum=7697745275879740&atk=1b6vd5dvuah7o9os","indeed_clk(this,'7819');","0b8cd3ab32f09e71",FALSE,FALSE,FALSE,"Ciudad de México, D. F.","hace 2 días","","unknown","unknown","USD",8800,8800
"293",2,"actuaria","","",TRUE,TRUE,421,276,300,11,"Docente Bachillerato UVM","Universidad del Valle de México Campus Roma","Cuauhtémoc","DIF","MX","Cuauhtémoc, D. F.","Indeed","Tue, 13 Dec 2016 18:23:28 GMT","*UVM* *está buscando talento como tú* *¡Únete! a nuestro equipo dentro del área de académica como: * *Docente* serás responsable de impartir catedra y dar","http://www.indeed.com.mx/viewjob?jk=941ee1c23a1025fd&qd=bi1irCVCGq9473EJ9E79kxCEXhjIMzb7lFAuRtDcUo_TcNKK_aY9kAcq4uhA63y4Wa7oCiuU6sncF-TpXaOJIR6nojn63AzuMLy1372sZMY&indpubnum=7697745275879740&atk=1b6vd5dvuah7o9os","indeed_clk(this,'7819');","941ee1c23a1025fd",FALSE,FALSE,TRUE,"Cuauhtémoc, D. F.","hace 30+ días","","unknown","unknown","USD",NA,NA
"294",2,"actuaria","","",TRUE,TRUE,421,276,300,11,"ANALISTA DE MODELOS DE RIESGO","SPG CAPITAL HUMANO SA DE CV","Ciudad de México","DIF","MX","Ciudad de México, D. F.","Indeed","Fri, 13 Jan 2017 06:50:30 GMT","En <b>actuaria</b>, matemáticas o economía *ÚNICAMENTE*. Estamos en la búsqueda de un *&quot;ANALISTA DE MODELOS DE RIESGO&quot;*....","http://www.indeed.com.mx/viewjob?jk=03e3af5e60225e34&qd=bi1irCVCGq9473EJ9E79kxCEXhjIMzb7lFAuRtDcUo_TcNKK_aY9kAcq4uhA63y4Wa7oCiuU6sncF-TpXaOJIR6nojn63AzuMLy1372sZMY&indpubnum=7697745275879740&atk=1b6vd5dvuah7o9os","indeed_clk(this,'7819');","03e3af5e60225e34",FALSE,FALSE,TRUE,"Ciudad de México, D. F.","hace 7 días","","unknown","unknown","USD",NA,NA
"295",2,"actuaria","","",TRUE,TRUE,421,276,300,11,"Analista de modelos de riesgo","SPG Capital Humano","Ciudad de México","DIF","MX","Ciudad de México, D. F.","Indeed","Thu, 12 Jan 2017 17:08:36 GMT","En <b>actuaria</b>, matemáticas o economía. Nos encontramos en la búsqueda de un *&quot;ANALISTA DE MODELOS DE RIESGO&quot;*....","http://www.indeed.com.mx/viewjob?jk=959ad71f1e9f6121&qd=bi1irCVCGq9473EJ9E79kxCEXhjIMzb7lFAuRtDcUo_TcNKK_aY9kAcq4uhA63y4Wa7oCiuU6sncF-TpXaOJIR6nojn63AzuMLy1372sZMY&indpubnum=7697745275879740&atk=1b6vd5dvuah7o9os","indeed_clk(this,'7819');","959ad71f1e9f6121",FALSE,FALSE,TRUE,"Ciudad de México, D. F.","hace 8 días","","unknown","unknown","USD",35000,35000
"296",2,"actuaria","","",TRUE,TRUE,421,276,300,11,"Analista base de datos","CDS México","Interlomas","MEX","MX","Interlomas, Méx.","Indeed","Tue, 20 Dec 2016 19:29:24 GMT","En <b>actuaría</b>, matematicas aplicadas, área económico administrativo ( pasante / titulado). Analista base de datos*....","http://www.indeed.com.mx/viewjob?jk=848aac61a6f27e4a&qd=bi1irCVCGq9473EJ9E79kxCEXhjIMzb7lFAuRtDcUo_TcNKK_aY9kAcq4uhA63y4Wa7oCiuU6sncF-TpXaOJIR6nojn63AzuMLy1372sZMY&indpubnum=7697745275879740&atk=1b6vd5dvuah7o9os","indeed_clk(this,'7819');","848aac61a6f27e4a",FALSE,FALSE,TRUE,"Interlomas, Méx.","hace 30+ días","","unknown","unknown","USD",12000,12000
"297",2,"actuaria","","",TRUE,TRUE,421,276,300,11,"Actuarios, Matemáticos, Analista Base de Datos","Converse","Ciudad de México","DIF","MX","Ciudad de México, D. F.","Indeed","Wed, 16 Nov 2016 22:18:26 GMT","<b>ACTUARIOS</b> - MATEMATICOS PARA EL AREA DE ANALISIS*. EDAD 2 5-33 AÑOS máximo....","http://www.indeed.com.mx/viewjob?jk=6a208b194e5f7bd2&qd=bi1irCVCGq9473EJ9E79kxCEXhjIMzb7lFAuRtDcUo_TcNKK_aY9kAcq4uhA63y4Wa7oCiuU6sncF-TpXaOJIR6nojn63AzuMLy1372sZMY&indpubnum=7697745275879740&atk=1b6vd5dvuah7o9os","indeed_clk(this,'7819');","6a208b194e5f7bd2",FALSE,FALSE,TRUE,"Ciudad de México, D. F.","hace 30+ días","","unknown","unknown","USD",11000,11000
"298",2,"actuaria","","",TRUE,TRUE,421,276,300,11,"ANALISTA DE INTELIGENCIA DE NEGOCIOS","MASTER LOYALTY GROUP SA DE CV","Lomas de Chapultepec","DIF","MX","Lomas de Chapultepec, D. F.","Indeed","Mon, 05 Dec 2016 19:06:53 GMT","Industrial, en Sistemas, <b>Actuaría</b> o afín pasante o titulado. Somos la Organización líder a Nivel Nacional en Mercadotecnia Relacional....","http://www.indeed.com.mx/viewjob?jk=add6d44e525c1bdf&qd=bi1irCVCGq9473EJ9E79kxCEXhjIMzb7lFAuRtDcUo_TcNKK_aY9kAcq4uhA63y4Wa7oCiuU6sncF-TpXaOJIR6nojn63AzuMLy1372sZMY&indpubnum=7697745275879740&atk=1b6vd5dvuah7o9os","indeed_clk(this,'7819');","add6d44e525c1bdf",FALSE,FALSE,TRUE,"Lomas de Chapultepec, D. F.","hace 30+ días","","unknown","unknown","USD",16000,16000
"299",2,"actuaria","","",TRUE,TRUE,421,276,300,11,"Coordinador de Producto","SPG Capital Humano","Ciudad de México","DIF","MX","Ciudad de México, D. F.","SPG capital humano","Thu, 12 Jan 2017 00:11:33 GMT","Administración de Empresas, <b>Actuaría</b>, Mercadotecnia o a fin. Importante Empresa Bancaria en Crecimiento....","http://www.indeed.com.mx/viewjob?jk=2897273059d46bfb&qd=bi1irCVCGq9473EJ9E79kxCEXhjIMzb7lFAuRtDcUo_TcNKK_aY9kAcq4uhA63y4Wa7oCiuU6sncF-TpXaOJIR6nojn63AzuMLy1372sZMY&indpubnum=7697745275879740&atk=1b6vd5dvuah7o9os","indeed_clk(this,'7819');","2897273059d46bfb",FALSE,FALSE,FALSE,"Ciudad de México, D. F.","hace 9 días","","unknown","unknown","USD",36500,36500
"300",2,"actuaria","","",TRUE,TRUE,421,276,300,11,"Programador UNIVERSE","LA LATINO SEGUROS","Ciudad de México","DIF","MX","Ciudad de México, D. F.","Indeed","Thu, 19 Jan 2017 21:04:57 GMT","*LA LATINO SEGUROS* Aseguradora con 110 años de trayectoria. Te invita a colaborar en el área de Sistemas, como: *P R O G R A M A D O R EN UNIVERSE* ...","http://www.indeed.com.mx/viewjob?jk=93078c09cdf14baa&qd=bi1irCVCGq9473EJ9E79kxCEXhjIMzb7lFAuRtDcUo_TcNKK_aY9kAcq4uhA63y4Wa7oCiuU6sncF-TpXaOJIR6nojn63AzuMLy1372sZMY&indpubnum=7697745275879740&atk=1b6vd5dvuah7o9os","indeed_clk(this,'7819');","93078c09cdf14baa",FALSE,FALSE,TRUE,"Ciudad de México, D. F.","hace 1 día","","unknown","unknown","USD",15000,15000
"301",2,"actuaria","","",TRUE,TRUE,421,301,325,12,"Actuaria Femenino","Seguridad Profesional Elite","Ciudad de México","DIF","MX","Ciudad de México, D. F.","Indeed","Wed, 18 Jan 2017 21:45:16 GMT","Género: Femenino Edad: 24-42 años Escolaridad: Lic. Actuaria ó Lic. Matemáticas Aplicadas Experiencia: en análisis de datos y estadísticas; creación,...","http://www.indeed.com.mx/viewjob?jk=236031c2cbdc8136&qd=bi1irCVCGq9473EJ9E79kxCEXhjIMzb7lFAuRtDcUo_TcNKK_aY9kAcq4uhA63y4Wa7oCiuU6sncF-TpXaOJIR6nojn63AzuMLy1372sZMY&indpubnum=7697745275879740&atk=1b6vd5e45ah7ndjv","indeed_clk(this,'7955');","236031c2cbdc8136",FALSE,FALSE,TRUE,"Ciudad de México, D. F.","hace 2 días","","unknown","unknown","USD",12000,12000
"302",2,"actuaria","","",TRUE,TRUE,421,301,325,12,"Auxiliar de Planeación de la Demanda","BEBE MART, S.A. DE C.V.","Ciudad de México","DIF","MX","Ciudad de México, D. F.","Indeed","Mon, 16 Jan 2017 21:12:06 GMT","Licenciado en <b>Actuaría</b>, Matemáticas o afín, pasante o titulado. Sexo y Edo....","http://www.indeed.com.mx/viewjob?jk=fbc928dfd0a69265&qd=bi1irCVCGq9473EJ9E79kxCEXhjIMzb7lFAuRtDcUo_TcNKK_aY9kAcq4uhA63y4Wa7oCiuU6sncF-TpXaOJIR6nojn63AzuMLy1372sZMY&indpubnum=7697745275879740&atk=1b6vd5e45ah7ndjv","indeed_clk(this,'7955');","fbc928dfd0a69265",FALSE,FALSE,TRUE,"Ciudad de México, D. F.","hace 4 días","","unknown","unknown","USD",10000,10000
"303",2,"actuaria","","",TRUE,TRUE,421,301,325,12,"Calidad","Rexortera","Ciudad de México","DIF","MX","Ciudad de México, D. F.","reXortera","Thu, 12 Jan 2017 09:43:08 GMT","Buscamos a una persona recién agresada de la carrera de <b>actuaría</b> o ingeniería industrial que nos apoye con el procesamiento de datos, análisis de procesos, etc....","http://www.indeed.com.mx/viewjob?jk=f9d35a09726bc507&qd=bi1irCVCGq9473EJ9E79kxCEXhjIMzb7lFAuRtDcUo_TcNKK_aY9kAcq4uhA63y4Wa7oCiuU6sncF-TpXaOJIR6nojn63AzuMLy1372sZMY&indpubnum=7697745275879740&atk=1b6vd5e45ah7ndjv","indeed_clk(this,'7955');","f9d35a09726bc507",FALSE,FALSE,TRUE,"Ciudad de México, D. F.","hace 8 días","","unknown","unknown","USD",NA,NA
"304",2,"actuaria","","",TRUE,TRUE,421,301,325,12,"Analista de Riego Operacional","CIBANCO INSTITUCION DE BANCA MULTIPLE SA DE CV","Ciudad de México","DIF","MX","Ciudad de México, D. F.","Indeed","Wed, 12 Oct 2016 16:54:06 GMT","Requisitos: * Sexo indistinto * Edad: 22 a 26 años * Escolaridad: *Actuario o matemático recién egresado* * *SIN EXPERIENCIA* Conocimientos indispensables:...","http://www.indeed.com.mx/viewjob?jk=d06ae21ea3e9c4e1&qd=bi1irCVCGq9473EJ9E79kxCEXhjIMzb7lFAuRtDcUo_TcNKK_aY9kAcq4uhA63y4Wa7oCiuU6sncF-TpXaOJIR6nojn63AzuMLy1372sZMY&indpubnum=7697745275879740&atk=1b6vd5e45ah7ndjv","indeed_clk(this,'7955');","d06ae21ea3e9c4e1",FALSE,FALSE,TRUE,"Ciudad de México, D. F.","hace 30+ días","","unknown","unknown","USD",NA,NA
"305",2,"actuaria","","",TRUE,TRUE,421,301,325,12,"Analista de planeación financiera","IN-Credit & Leasing","Ciudad de México","DIF","MX","Ciudad de México, D. F.","Indeed","Mon, 10 Oct 2016 19:24:07 GMT","En <b>Actuaría</b>, Matemáticas con especialidad en análisis financiero, Finanzas, Economía.Edad:. IN-Credit &amp; Leasing una de las Mejores Empresas Mexicanas, solicita*...","http://www.indeed.com.mx/viewjob?jk=c95d0faaf79872f3&qd=bi1irCVCGq9473EJ9E79kxCEXhjIMzb7lFAuRtDcUo_TcNKK_aY9kAcq4uhA63y4Wa7oCiuU6sncF-TpXaOJIR6nojn63AzuMLy1372sZMY&indpubnum=7697745275879740&atk=1b6vd5e45ah7ndjv","indeed_clk(this,'7955');","c95d0faaf79872f3",FALSE,FALSE,TRUE,"Ciudad de México, D. F.","hace 30+ días","","unknown","unknown","USD",15000,15000
"306",2,"actuaria","","",TRUE,TRUE,421,301,325,12,"Analista de Datos","Quiero Casa","Ciudad de México","DIF","MX","Ciudad de México, D. F.","Quiero Casa","Fri, 30 Sep 2016 07:15:48 GMT","Terminada en <b>Actuaría</b>, estadistica, informática o afín- 100% de créditos. IMPORTANTE EMPRESA INMOBILIARIA SOLICITA....","http://www.indeed.com.mx/viewjob?jk=4d9c357fef1f08cc&qd=bi1irCVCGq9473EJ9E79kxCEXhjIMzb7lFAuRtDcUo_TcNKK_aY9kAcq4uhA63y4Wa7oCiuU6sncF-TpXaOJIR6nojn63AzuMLy1372sZMY&indpubnum=7697745275879740&atk=1b6vd5e45ah7ndjv","indeed_clk(this,'7955');","4d9c357fef1f08cc",FALSE,FALSE,FALSE,"Ciudad de México, D. F.","hace 30+ días","","unknown","unknown","USD",25000,25000
"307",2,"actuaria","","",TRUE,TRUE,421,301,325,12,"Coordinador de Riesgos","SMB Rural","Colonia Roma","DIF","MX","Colonia Roma, D. F.","Indeed","Thu, 12 Jan 2017 23:55:57 GMT","Matematicas o <b>Actuaria</b> (Pasante o Titulado)*. _SMB RURAL Es una intermediación financiera de ahorro y crédito, actualmente opera en Oaxaca, Tlaxacala, Puebla,...","http://www.indeed.com.mx/viewjob?jk=c0d114f3c6bd4670&qd=bi1irCVCGq9473EJ9E79kxCEXhjIMzb7lFAuRtDcUo_TcNKK_aY9kAcq4uhA63y4Wa7oCiuU6sncF-TpXaOJIR6nojn63AzuMLy1372sZMY&indpubnum=7697745275879740&atk=1b6vd5e45ah7ndjv","indeed_clk(this,'7955');","c0d114f3c6bd4670",FALSE,FALSE,TRUE,"Colonia Roma, D. F.","hace 8 días","","unknown","unknown","USD",23000,23000
"308",2,"actuaria","","",TRUE,TRUE,421,301,325,12,"Especialista en implantación de sistemas informáticos","Bureau Veritas","Ciudad de México","DIF","MX","Ciudad de México, D. F.","Indeed","Mon, 16 Jan 2017 23:55:18 GMT","Computación, <b>Actuario</b>, matemáticas aplicadas, sistemas computacionales, ingeniería del software, informática o afín....","http://www.indeed.com.mx/viewjob?jk=191c4d57ee42ab91&qd=bi1irCVCGq9473EJ9E79kxCEXhjIMzb7lFAuRtDcUo_TcNKK_aY9kAcq4uhA63y4Wa7oCiuU6sncF-TpXaOJIR6nojn63AzuMLy1372sZMY&indpubnum=7697745275879740&atk=1b6vd5e45ah7ndjv","indeed_clk(this,'7955');","191c4d57ee42ab91",FALSE,FALSE,TRUE,"Ciudad de México, D. F.","hace 4 días","","unknown","unknown","USD",30000,30000
"309",2,"actuaria","","",TRUE,TRUE,421,301,325,12,"Pasante de Derecho","AUTOFIN MEXICO S.A DE C.V","Ciudad de México","DIF","MX","Ciudad de México, D. F.","Indeed","Sat, 14 Jan 2017 19:00:26 GMT","Agendar citas con <b>Actuarios</b>. Empresa líder en el Autofinanciamiento con 39 años de experiencia en el mercado te invita a formar parte de su equipo de trabajo....","http://www.indeed.com.mx/viewjob?jk=b5672aa5aa09b4f1&qd=bi1irCVCGq9473EJ9E79kxCEXhjIMzb7lFAuRtDcUo_TcNKK_aY9kAcq4uhA63y4Wa7oCiuU6sncF-TpXaOJIR6nojn63AzuMLy1372sZMY&indpubnum=7697745275879740&atk=1b6vd5e45ah7ndjv","indeed_clk(this,'7955');","b5672aa5aa09b4f1",FALSE,FALSE,TRUE,"Ciudad de México, D. F.","hace 6 días","","unknown","unknown","USD",5000,5000
"310",2,"actuaria","","",TRUE,TRUE,421,301,325,12,"PLANEADOR DE LA DEMANDA Y PRODUCCION","EXPRESION","Ciudad de México","DIF","MX","Ciudad de México, D. F.","Indeed","Thu, 12 Jan 2017 18:25:44 GMT","<b>Actuaria</b>, Economía, Matemáticas, Ingeniería o a fin (pasante o titulado). 25 A 35....","http://www.indeed.com.mx/viewjob?jk=8b0baa28f38b3d56&qd=bi1irCVCGq9473EJ9E79kxCEXhjIMzb7lFAuRtDcUo_TcNKK_aY9kAcq4uhA63y4Wa7oCiuU6sncF-TpXaOJIR6nojn63AzuMLy1372sZMY&indpubnum=7697745275879740&atk=1b6vd5e45ah7ndjv","indeed_clk(this,'7955');","8b0baa28f38b3d56",FALSE,FALSE,TRUE,"Ciudad de México, D. F.","hace 8 días","","unknown","unknown","USD",12000,12000
"311",2,"actuaria","","",TRUE,TRUE,421,301,325,12,"Consultor de modelo","DMT","Ciudad de México","DIF","MX","Ciudad de México, D. F.","DMT","Tue, 10 Jan 2017 00:20:35 GMT","En <b>actuaria</b>, metematicas o economia. Nos encontramos en la busqueda de un &quot;ANALISTA DE MODELOS DE RIESGO&quot; para integrarse a laborar a importante institucion...","http://www.indeed.com.mx/viewjob?jk=469594be43cfb0f5&qd=bi1irCVCGq9473EJ9E79kxCEXhjIMzb7lFAuRtDcUo_TcNKK_aY9kAcq4uhA63y4Wa7oCiuU6sncF-TpXaOJIR6nojn63AzuMLy1372sZMY&indpubnum=7697745275879740&atk=1b6vd5e45ah7ndjv","indeed_clk(this,'7955');","469594be43cfb0f5",FALSE,FALSE,FALSE,"Ciudad de México, D. F.","hace 11 días","","unknown","unknown","USD",35000,35000
"312",2,"actuaria","","",TRUE,TRUE,421,301,325,12,"Lider de Proyectos en Investigación de Mercados","IMCS, S.A. DE C.V.","Miguel Hidalgo","DIF","MX","Miguel Hidalgo, D. F.","Indeed","Sat, 07 Jan 2017 17:06:33 GMT","Mercadotecnia, <b>Actuaría</b>, Economía, Administración de Empresas o afin (Titulado o pasante) Experiencia:. Empresa líder en Investigación de Mercados solicita 2...","http://www.indeed.com.mx/viewjob?jk=9afd7f8de78ee196&qd=bi1irCVCGq9473EJ9E79kxCEXhjIMzb7lFAuRtDcUo_TcNKK_aY9kAcq4uhA63y4Wa7oCiuU6sncF-TpXaOJIR6nojn63AzuMLy1372sZMY&indpubnum=7697745275879740&atk=1b6vd5e45ah7ndjv","indeed_clk(this,'7955');","9afd7f8de78ee196",FALSE,FALSE,TRUE,"Miguel Hidalgo, D. F.","hace 13 días","","unknown","unknown","USD",15000,15000
"313",2,"actuaria","","",TRUE,TRUE,421,301,325,12,"Analista Estadistico","MOVIS S.A. DE C.V.","Naucalpan","MEX","MX","Naucalpan, Méx.","Indeed","Thu, 10 Nov 2016 23:33:55 GMT","Matemáticas, <b>Actuaría</b>, Ingeniería Industrial,*. ANALISTA Estadístico, Business*....","http://www.indeed.com.mx/viewjob?jk=2a6bab20ec60daef&qd=bi1irCVCGq9473EJ9E79kxCEXhjIMzb7lFAuRtDcUo_TcNKK_aY9kAcq4uhA63y4Wa7oCiuU6sncF-TpXaOJIR6nojn63AzuMLy1372sZMY&indpubnum=7697745275879740&atk=1b6vd5e45ah7ndjv","indeed_clk(this,'7955');","2a6bab20ec60daef",FALSE,FALSE,TRUE,"Naucalpan, Méx.","hace 30+ días","","unknown","unknown","USD",NA,NA
"314",2,"actuaria","","",TRUE,TRUE,421,301,325,12,"Especialista en Prevención de Fraudes","Selecciona Outsourcing Solutions","Ciudad de México","DIF","MX","Ciudad de México, D. F.","Indeed","Wed, 04 Jan 2017 00:40:09 GMT","Licenciatura en Contabilidad, Finanzas, <b>Actuaría</b> o a fin (Titulado), se valorará posgrado.. Financiera Trasnacional líder en el otorgamiento de créditos con...","http://www.indeed.com.mx/viewjob?jk=d773253ca5bca366&qd=bi1irCVCGq9473EJ9E79kxCEXhjIMzb7lFAuRtDcUo_TcNKK_aY9kAcq4uhA63y4Wa7oCiuU6sncF-TpXaOJIR6nojn63AzuMLy1372sZMY&indpubnum=7697745275879740&atk=1b6vd5e45ah7ndjv","indeed_clk(this,'7955');","d773253ca5bca366",FALSE,FALSE,TRUE,"Ciudad de México, D. F.","hace 17 días","","unknown","unknown","USD",50000,50000
"315",2,"actuaria","","",TRUE,TRUE,421,301,325,12,"Recién Egresados de Actuaría, Economía, Administración o afín","Dish México","Ciudad de México","DIF","MX","Ciudad de México, D. F.","Indeed","Mon, 02 Jan 2017 14:34:16 GMT","Requisitos: Escolaridad deseable: Lic. Actuaría, Economía, Administración o carrera afín. Zona de trabajo: Sur. *Experiencia: No necesaria.* Conocimientos...","http://www.indeed.com.mx/viewjob?jk=05f0c464747a9263&qd=bi1irCVCGq9473EJ9E79kxCEXhjIMzb7lFAuRtDcUo_TcNKK_aY9kAcq4uhA63y4Wa7oCiuU6sncF-TpXaOJIR6nojn63AzuMLy1372sZMY&indpubnum=7697745275879740&atk=1b6vd5e45ah7ndjv","indeed_clk(this,'7955');","05f0c464747a9263",FALSE,FALSE,TRUE,"Ciudad de México, D. F.","hace 18 días","","unknown","unknown","USD",7000,7000
"316",2,"actuaria","","",TRUE,TRUE,421,301,325,12,"EJECUTIVO EN ESTADISTICAS","AGENTE DE SEGUROS Y DE FIANZAS, S.A DE C.V.","Polanco","DIF","MX","Polanco, D. F.","Indeed","Wed, 04 Jan 2017 23:17:06 GMT","ESCOLARIDAD LICENCIATURA CONCLUIDA EN ADMINISTRACION O <b>ACTUARIA</b>. IMPORTANTE EMPRESA DE SEGUROS SOLICITA:....","http://www.indeed.com.mx/viewjob?jk=c8b4e821bcf91173&qd=bi1irCVCGq9473EJ9E79kxCEXhjIMzb7lFAuRtDcUo_TcNKK_aY9kAcq4uhA63y4Wa7oCiuU6sncF-TpXaOJIR6nojn63AzuMLy1372sZMY&indpubnum=7697745275879740&atk=1b6vd5e45ah7ndjv","indeed_clk(this,'7955');","c8b4e821bcf91173",FALSE,FALSE,TRUE,"Polanco, D. F.","hace 16 días","","unknown","unknown","USD",7500,7500
"317",2,"actuaria","","",TRUE,TRUE,421,301,325,12,"GERENTE COMERCIAL EN AGENCIAS BTL","PROTARGET S.A DE C.V","Ciudad de México","DIF","MX","Ciudad de México, D. F.","Indeed","Mon, 02 Jan 2017 18:25:04 GMT","En Mercadotecnia, Comunicación, <b>Actuaria</b> o afín. GERENTE COMERCIAL EN AGENCIAS BTL*....","http://www.indeed.com.mx/viewjob?jk=25696232db610d71&qd=bi1irCVCGq9473EJ9E79kxCEXhjIMzb7lFAuRtDcUo_TcNKK_aY9kAcq4uhA63y4Wa7oCiuU6sncF-TpXaOJIR6nojn63AzuMLy1372sZMY&indpubnum=7697745275879740&atk=1b6vd5e45ah7ndjv","indeed_clk(this,'7955');","25696232db610d71",FALSE,FALSE,TRUE,"Ciudad de México, D. F.","hace 18 días","","unknown","unknown","USD",20000,20000
"318",2,"actuaria","","",TRUE,TRUE,421,301,325,12,"ANALISTA DE INFORMACION","PETRUM GASOLINERAS","Monterrey","NLE","MX","Monterrey, N. L.","Indeed","Mon, 05 Dec 2016 20:00:23 GMT","<b>Actuaria</b>, Economía, Ingeniería, preferentemente. Analista de información (cubre incapacidad de 3 meses)....","http://www.indeed.com.mx/viewjob?jk=ee89f14ca06e0942&qd=bi1irCVCGq9473EJ9E79kxCEXhjIMzb7lFAuRtDcUo_TcNKK_aY9kAcq4uhA63y4Wa7oCiuU6sncF-TpXaOJIR6nojn63AzuMLy1372sZMY&indpubnum=7697745275879740&atk=1b6vd5e45ah7ndjv","indeed_clk(this,'7955');","ee89f14ca06e0942",FALSE,FALSE,TRUE,"Monterrey, N. L.","hace 30+ días","","unknown","unknown","USD",NA,NA
"319",2,"actuaria","","",TRUE,TRUE,421,301,325,12,"Ejecutivo de Cuentas Especiales","Alia","Gustavo A. Madero","DIF","MX","Gustavo A. Madero, D. F.","Indeed","Fri, 06 Jan 2017 23:03:01 GMT","Pasante de Licenciatura en Administración, <b>Actuaría</b> Ingeniería Industrial, Sistemas, Matemáticas o afines. Empresa mexicana enfocada en brindar Servicios de...","http://www.indeed.com.mx/viewjob?jk=be9fa27de68f4dac&qd=bi1irCVCGq9473EJ9E79kxCEXhjIMzb7lFAuRtDcUo_TcNKK_aY9kAcq4uhA63y4Wa7oCiuU6sncF-TpXaOJIR6nojn63AzuMLy1372sZMY&indpubnum=7697745275879740&atk=1b6vd5e45ah7ndjv","indeed_clk(this,'7955');","be9fa27de68f4dac",FALSE,FALSE,TRUE,"Gustavo A. Madero, D. F.","hace 14 días","","unknown","unknown","USD",11000,11000
"320",2,"actuaria","","",TRUE,TRUE,421,301,325,12,"PROGRAMADOR UNIVERSE","La Latinoamericana - Seguros","","","MX","México","La Latinoamericana - Seguros","Sat, 31 Dec 2016 01:07:28 GMT","LA LATINO SEGUROS Aseguradora con 110 años de trayectoria. Te invita a colaborar en el área de Sistemas, como: PROGRAMADOR UNIVERSE REQUISITOS....","http://www.indeed.com.mx/viewjob?jk=5099e0553108b800&qd=bi1irCVCGq9473EJ9E79kxCEXhjIMzb7lFAuRtDcUo_TcNKK_aY9kAcq4uhA63y4Wa7oCiuU6sncF-TpXaOJIR6nojn63AzuMLy1372sZMY&indpubnum=7697745275879740&atk=1b6vd5e45ah7ndjv","indeed_clk(this,'7955');","5099e0553108b800",FALSE,FALSE,FALSE,"México","hace 21 días","","unknown","unknown","USD",15000,15000
"321",2,"actuaria","","",TRUE,TRUE,421,301,325,12,"GERENTE DE CADENA DE SUMINISTRO","PRICE SHOES (Corporativo México)","Ciudad de México","DIF","MX","Ciudad de México, D. F.","Indeed","Sat, 24 Dec 2016 00:37:59 GMT","Industrial, logística, matemática aplicada o <b>actuaria</b>, economistas o afín. EMPRESA LIDER EN RETAIL, SOLICITA POR EXPANSION*....","http://www.indeed.com.mx/viewjob?jk=d1fda329ab1296aa&qd=bi1irCVCGq9473EJ9E79kxCEXhjIMzb7lFAuRtDcUo_TcNKK_aY9kAcq4uhA63y4Wa7oCiuU6sncF-TpXaOJIR6nojn63AzuMLy1372sZMY&indpubnum=7697745275879740&atk=1b6vd5e45ah7ndjv","indeed_clk(this,'7955');","d1fda329ab1296aa",FALSE,FALSE,TRUE,"Ciudad de México, D. F.","hace 28 días","","unknown","unknown","USD",35000,35000
"322",2,"actuaria","","",TRUE,TRUE,421,301,325,12,"WORKFORCE MANAGEMENT / Analista OMD","SYKES MEXICO","Tlalnepantla","MEX","MX","Tlalnepantla, Méx.","Indeed","Tue, 25 Oct 2016 22:50:28 GMT","Licenciatura en <b>Actuaría</b>, Ingeniería Industrial o afín Ingles Avanzado (80%).Manejo de Paquetería de Office Experiencia:. (Work Force Management)....","http://www.indeed.com.mx/viewjob?jk=ffd661fd5db67ef2&qd=bi1irCVCGq9473EJ9E79kxCEXhjIMzb7lFAuRtDcUo_TcNKK_aY9kAcq4uhA63y4Wa7oCiuU6sncF-TpXaOJIR6nojn63AzuMLy1372sZMY&indpubnum=7697745275879740&atk=1b6vd5e45ah7ndjv","indeed_clk(this,'7955');","ffd661fd5db67ef2",FALSE,FALSE,TRUE,"Tlalnepantla, Méx.","hace 30+ días","","unknown","unknown","USD",17000,17000
"323",2,"actuaria","","",TRUE,TRUE,421,301,325,12,"Pasante de Derecho","Bufete de Abogados Quintana Díaz, S.C.","Colonia Bosques de las Lomas","DIF","MX","Colonia Bosques de las Lomas, D. F.","Indeed","Tue, 03 Jan 2017 22:18:23 GMT","Pasante de Derecho con carrera terminada. Con experiencia en revisión de Boletín Judicial, revisión de expedientes en Juzgados Federales, de la Ciudad de...","http://www.indeed.com.mx/viewjob?jk=246fe912edd71450&qd=bi1irCVCGq9473EJ9E79kxCEXhjIMzb7lFAuRtDcUo_TcNKK_aY9kAcq4uhA63y4Wa7oCiuU6sncF-TpXaOJIR6nojn63AzuMLy1372sZMY&indpubnum=7697745275879740&atk=1b6vd5e45ah7ndjv","indeed_clk(this,'7955');","246fe912edd71450",FALSE,FALSE,TRUE,"Colonia Bosques de las Lomas, D. F.","hace 17 días","","unknown","unknown","USD",NA,NA
"324",2,"actuaria","","",TRUE,TRUE,421,301,325,12,"Gerente Comercial en agencia BTL","PROTARGET S.A DE C.V","Ciudad de México","DIF","MX","Ciudad de México, D. F.","Indeed","Thu, 24 Nov 2016 19:34:04 GMT","*Requisitos: * * *Edad: de 25 a 35 años* Sexo: Indistinto Escolaridad: Lic. en Mercadotecnia, Comunicación, Actuaria o afín *Inglés Conversacional Avanzado...","http://www.indeed.com.mx/viewjob?jk=fe75ee9124523ad8&qd=bi1irCVCGq9473EJ9E79kxCEXhjIMzb7lFAuRtDcUo_TcNKK_aY9kAcq4uhA63y4Wa7oCiuU6sncF-TpXaOJIR6nojn63AzuMLy1372sZMY&indpubnum=7697745275879740&atk=1b6vd5e45ah7ndjv","indeed_clk(this,'7955');","fe75ee9124523ad8",FALSE,FALSE,TRUE,"Ciudad de México, D. F.","hace 30+ días","","unknown","unknown","USD",22000,22000
"325",2,"actuaria","","",TRUE,TRUE,421,301,325,12,"Actuario","Mercer - Consultoría de RRHH a nivel global","Ciudad de México","DIF","MX","Ciudad de México, D. F.","Indeed","Tue, 13 Dec 2016 18:50:06 GMT","Licenciatura en <b>Actuaria</b>. 1 a 2 años de experiencia en puesto similar....","http://www.indeed.com.mx/viewjob?jk=8c3d117c7cf68b50&qd=bi1irCVCGq9473EJ9E79kxCEXhjIMzb7lFAuRtDcUo_TcNKK_aY9kAcq4uhA63y4Wa7oCiuU6sncF-TpXaOJIR6nojn63AzuMLy1372sZMY&indpubnum=7697745275879740&atk=1b6vd5e45ah7ndjv","indeed_clk(this,'7955');","8c3d117c7cf68b50",FALSE,FALSE,TRUE,"Ciudad de México, D. F.","hace 30+ días","","unknown","unknown","USD",NA,NA
