"","version","query","location","paginationPayload","dupefilter","highlight","totalResults","start","end","pageNumber","results.jobtitle","results.company","results.city","results.state","results.country","results.formattedLocation","results.source","results.date","results.snippet","results.url","results.onmousedown","results.jobkey","results.sponsored","results.expired","results.indeedApply","results.formattedLocationFull","results.formattedRelativeTime","results.stations","status","period","currency","minSal","maxSal"
"109",2,"actuaria","","",TRUE,TRUE,421,101,125,4,"Gerencia Suscripción Vida Individual","GNP Seguros Corporativo","Ciudad de México","DIF","MX","Ciudad de México, D. F.","bumeran.com.mx","Fri, 06 Jan 2017 18:06:48 GMT","Licenciatura en <b>Actuaría</b> o Económico - Administrativa (con Título). Garantizar una adecuada suscripción de negocios de vida individual supervisando la...","http://www.indeed.com.mx/viewjob?jk=cda4c4cfe91b1789&qd=bi1irCVCGq9473EJ9E79kxCEXhjIMzb7lFAuRtDcUo_TcNKK_aY9kAcq4uhA63y4Bh_byP2F8i2GkwKcxxcL2R6nojn63AzuMLy1372sZMY&indpubnum=7697745275879740&atk=1b6vd5cuhah7of0i","indeed_clk(this,'6750');","cda4c4cfe91b1789",FALSE,FALSE,FALSE,"Ciudad de México, D. F.","hace 14 días","","unknown","unknown","USD",31500,31500
"110",2,"actuaria","","",TRUE,TRUE,421,101,125,4,"Business Analyst","Accenture","Ciudad de México","DIF","MX","Ciudad de México, D. F.","Accenture","Sun, 11 Dec 2016 07:14:00 GMT","Licenciatura en Matemáticas, <b>Actuaría</b>, Ingenierías de Sistemas o afín. Accenture es una compañía líder a nivel global que otorga servicios de consultoría de...","http://www.indeed.com.mx/viewjob?jk=5b45ca95d9031dcc&qd=bi1irCVCGq9473EJ9E79kxCEXhjIMzb7lFAuRtDcUo_TcNKK_aY9kAcq4uhA63y4Bh_byP2F8i2GkwKcxxcL2R6nojn63AzuMLy1372sZMY&indpubnum=7697745275879740&atk=1b6vd5cuhah7of0i","indeed_clk(this,'6750');","5b45ca95d9031dcc",FALSE,FALSE,FALSE,"Ciudad de México, D. F.","hace 30+ días","","unknown","unknown","USD",NA,NA
"111",2,"actuaria","","",TRUE,TRUE,421,101,125,4,"Scrum Master","Citi","Ciudad de México","DIF","MX","Ciudad de México, D. F.","Citi","Thu, 06 Oct 2016 06:00:21 GMT","Primary Location: Mexico,Distrito Federal Education: Bachelor's Degree Job Function: Administration Schedule: Full-time Shift: Day Job Employee Status:...","http://www.indeed.com.mx/viewjob?jk=773cc2cdb6bbe7c3&qd=bi1irCVCGq9473EJ9E79kxCEXhjIMzb7lFAuRtDcUo_TcNKK_aY9kAcq4uhA63y4Bh_byP2F8i2GkwKcxxcL2R6nojn63AzuMLy1372sZMY&indpubnum=7697745275879740&atk=1b6vd5cuhah7of0i","indeed_clk(this,'6750');","773cc2cdb6bbe7c3",FALSE,FALSE,FALSE,"Ciudad de México, D. F.","hace 30+ días","","unknown","unknown","USD",NA,NA
"112",2,"actuaria","","",TRUE,TRUE,421,101,125,4,"Scrum Master","Banamex","Ciudad de México","DIF","MX","Ciudad de México, D. F.","Banamex","Wed, 05 Oct 2016 01:01:08 GMT","Perfil del Puesto Vacante Escolaridad Licenciatura en ciencias computacionales/Informática, Ingeniería Industrial, Economía. Matemáticas o Actuaría, o...","http://www.indeed.com.mx/viewjob?jk=7cc030d629f03a6e&qd=bi1irCVCGq9473EJ9E79kxCEXhjIMzb7lFAuRtDcUo_TcNKK_aY9kAcq4uhA63y4Bh_byP2F8i2GkwKcxxcL2R6nojn63AzuMLy1372sZMY&indpubnum=7697745275879740&atk=1b6vd5cuhah7of0i","indeed_clk(this,'6750');","7cc030d629f03a6e",FALSE,FALSE,FALSE,"Ciudad de México, D. F.","hace 30+ días","","unknown","unknown","USD",NA,NA
"113",2,"actuaria","","",TRUE,TRUE,421,101,125,4,"Becarios Administrativos Accenture - $8000","PROBECARIOS","Miguel Hidalgo","DIF","MX","Miguel Hidalgo, D. F.","bumeran.com.mx","Thu, 12 Jan 2017 06:39:02 GMT","Estudiantes a partir de 6to semestre de administración, negocios internacionales, <b>actuaría</b>, economía, finanzas y banca....","http://www.indeed.com.mx/viewjob?jk=a953aa9a2b4b0692&qd=bi1irCVCGq9473EJ9E79kxCEXhjIMzb7lFAuRtDcUo_TcNKK_aY9kAcq4uhA63y4Bh_byP2F8i2GkwKcxxcL2R6nojn63AzuMLy1372sZMY&indpubnum=7697745275879740&atk=1b6vd5cuhah7of0i","indeed_clk(this,'6750');","a953aa9a2b4b0692",FALSE,FALSE,FALSE,"Miguel Hidalgo, D. F.","hace 8 días","","unknown","unknown","USD",NA,NA
"114",2,"actuaria","","",TRUE,TRUE,421,101,125,4,"Analista de Compensación Variable","Page Personnel México","Ciudad de México","DIF","MX","Ciudad de México, D. F.","Page Personnel México","Fri, 09 Dec 2016 19:01:46 GMT","Licenciatura en Economía, <b>Actuaría</b>, Matemáticas, Ingeniería en Programación o carrera afín. Las principales responsabilidades son:....","http://www.indeed.com.mx/viewjob?jk=68b9ec54c050207b&qd=bi1irCVCGq9473EJ9E79kxCEXhjIMzb7lFAuRtDcUo_TcNKK_aY9kAcq4uhA63y4Bh_byP2F8i2GkwKcxxcL2R6nojn63AzuMLy1372sZMY&indpubnum=7697745275879740&atk=1b6vd5cuhah7of0i","indeed_clk(this,'6750');","68b9ec54c050207b",FALSE,FALSE,FALSE,"Ciudad de México, D. F.","hace 30+ días","","unknown","unknown","USD",15000,18000
"115",2,"actuaria","","",TRUE,TRUE,421,101,125,4,"Coordinador Data Science Lab.","Cinépolis","","","MX","México","bumeran.com.mx","Sat, 07 Jan 2017 06:26:15 GMT","Lic <b>Actuaria</b>, Estadística o Económica (Titulado indispensable). “El trabajo de tus sueños, no está en las películas, esta aquí”....","http://www.indeed.com.mx/viewjob?jk=c7612fa10b8bac11&qd=bi1irCVCGq9473EJ9E79kxCEXhjIMzb7lFAuRtDcUo_TcNKK_aY9kAcq4uhA63y4Bh_byP2F8i2GkwKcxxcL2R6nojn63AzuMLy1372sZMY&indpubnum=7697745275879740&atk=1b6vd5cuhah7of0i","indeed_clk(this,'6750');","c7612fa10b8bac11",FALSE,FALSE,FALSE,"México","hace 13 días","","unknown","unknown","USD",NA,NA
"116",2,"actuaria","","",TRUE,TRUE,421,101,125,4,"Tester Jr.","SOLUCIONES KABEC","Ciudad de México","DIF","MX","Ciudad de México, D. F.","bumeran.com.mx","Mon, 02 Jan 2017 18:01:52 GMT","Kabec, Empresa de T.I. con más de 17 años en el mercado solicita Tester Jr. Requisitos: • Escolaridad: Ing. de Sistemas, Ing. en Computación, Lic. En...","http://www.indeed.com.mx/viewjob?jk=4cc1addb98778f08&qd=bi1irCVCGq9473EJ9E79kxCEXhjIMzb7lFAuRtDcUo_TcNKK_aY9kAcq4uhA63y4Bh_byP2F8i2GkwKcxxcL2R6nojn63AzuMLy1372sZMY&indpubnum=7697745275879740&atk=1b6vd5cuhah7of0i","indeed_clk(this,'6750');","4cc1addb98778f08",FALSE,FALSE,FALSE,"Ciudad de México, D. F.","hace 18 días","","unknown","unknown","USD",NA,NA
"117",2,"actuaria","","",TRUE,TRUE,421,101,125,4,"AUDITOR TR. RIESGOS Y CREDITO","","Cuajimalpa","DIF","MX","Cuajimalpa, D. F.","bumeran.com.mx","Sat, 14 Jan 2017 06:17:30 GMT","Licenciatura en <b>Actuaria</b>, Matemáticas aplicadas, Finanzas. IMPORTANTE INSTITUCION BANCARIA....","http://www.indeed.com.mx/viewjob?jk=33a7928bc53f975b&qd=bi1irCVCGq9473EJ9E79kxCEXhjIMzb7lFAuRtDcUo_TcNKK_aY9kAcq4uhA63y4Bh_byP2F8i2GkwKcxxcL2R6nojn63AzuMLy1372sZMY&indpubnum=7697745275879740&atk=1b6vd5cuhah7of0i","indeed_clk(this,'6750');","33a7928bc53f975b",FALSE,FALSE,FALSE,"Cuajimalpa, D. F.","hace 6 días","","unknown","unknown","USD",12000,12000
"118",2,"actuaria","","",TRUE,TRUE,421,101,125,4,"ASISTENTE DE COORDINACIÓN","Babel International Translators","Benito Juárez","ROO","MX","Benito Juárez, QRoo.","bumeran.com.mx","Thu, 19 Jan 2017 06:24:48 GMT","Escolaridad mínima Licenciatura en el área matemática (Matemáticas, <b>Actuaría</b>, afin). BABEL INTERNATIONAL TRANSLATORS es una Agencia de Traducciones anglo...","http://www.indeed.com.mx/viewjob?jk=55b09a54fe79328e&qd=bi1irCVCGq9473EJ9E79kxCEXhjIMzb7lFAuRtDcUo_TcNKK_aY9kAcq4uhA63y4Bh_byP2F8i2GkwKcxxcL2R6nojn63AzuMLy1372sZMY&indpubnum=7697745275879740&atk=1b6vd5cuhah7of0i","indeed_clk(this,'6750');","55b09a54fe79328e",FALSE,FALSE,FALSE,"Benito Juárez, QRoo.","hace 1 día","","unknown","unknown","USD",8800,11000
"119",2,"actuaria","","",TRUE,TRUE,421,101,125,4,"Especialista Inteligencia de Mercados","Grupo Posadas","Ciudad de México","DIF","MX","Ciudad de México, D. F.","bumeran.com.mx","Fri, 13 Jan 2017 06:16:21 GMT","Unicamente egresados de la Licenciatura en Economía ó <b>Actuaria</b>. Forma parte del Grupo de Líderes Hoteleros en México, actualmente Grupo Posadas opera más de 150...","http://www.indeed.com.mx/viewjob?jk=9f02a1f5a8238df1&qd=bi1irCVCGq9473EJ9E79kxCEXhjIMzb7lFAuRtDcUo_TcNKK_aY9kAcq4uhA63y4Bh_byP2F8i2GkwKcxxcL2R6nojn63AzuMLy1372sZMY&indpubnum=7697745275879740&atk=1b6vd5cuhah7of0i","indeed_clk(this,'6750');","9f02a1f5a8238df1",FALSE,FALSE,FALSE,"Ciudad de México, D. F.","hace 7 días","","unknown","unknown","USD",NA,NA
"120",2,"actuaria","","",TRUE,TRUE,421,101,125,4,"Requerimiento 66 -Líder y programador ASP.NET.","Ecosistemas Group","","MEX","MX","Edo. de México","Ecosistemas Group","Thu, 24 Nov 2016 11:45:18 GMT","Perfil muy especializado, que le gusten los números (Actuario, Ingeniero o Financiero) y que a funja como Líder de Proyecto y a la vez Analista Programador","http://www.indeed.com.mx/viewjob?jk=5e60d740ef3947db&qd=bi1irCVCGq9473EJ9E79kxCEXhjIMzb7lFAuRtDcUo_TcNKK_aY9kAcq4uhA63y4Bh_byP2F8i2GkwKcxxcL2R6nojn63AzuMLy1372sZMY&indpubnum=7697745275879740&atk=1b6vd5cuhah7of0i","indeed_clk(this,'6750');","5e60d740ef3947db",FALSE,FALSE,FALSE,"Edo. de México","hace 30+ días","","unknown","unknown","USD",NA,NA
"121",2,"actuaria","","",TRUE,TRUE,421,101,125,4,"COORDINADOR DE PRODUCTO","amedirh","Ciudad de México","DIF","MX","Ciudad de México, D. F.","amedirh","Thu, 19 Jan 2017 19:17:21 GMT","Administración de Empresas, Mercadotecnia, <b>Actuaría</b>, Negocios Internacionales o afin. Esc:....","http://www.indeed.com.mx/viewjob?jk=2a4e2fd7d3e08bc4&qd=bi1irCVCGq9473EJ9E79kxCEXhjIMzb7lFAuRtDcUo_TcNKK_aY9kAcq4uhA63y4Bh_byP2F8i2GkwKcxxcL2R6nojn63AzuMLy1372sZMY&indpubnum=7697745275879740&atk=1b6vd5cuhah7of0i","indeed_clk(this,'6750');","2a4e2fd7d3e08bc4",FALSE,FALSE,FALSE,"Ciudad de México, D. F.","hace 1 día","","unknown","unknown","USD",36500,45500
"122",2,"actuaria","","",TRUE,TRUE,421,101,125,4,"Becarios Administrativos Accenture Miguel Hidalgo y Santa Fe - $8000","Probecarios","Ciudad de México","DIF","MX","Ciudad de México, D. F.","Trabajando.com","Thu, 12 Jan 2017 08:48:33 GMT","Estudiantes a partir de 6to semestre de administración, negocios internacionales, <b>actuaría</b>, economía, finanzas y banca....","http://www.indeed.com.mx/viewjob?jk=e362bd17e4e36fe2&qd=bi1irCVCGq9473EJ9E79kxCEXhjIMzb7lFAuRtDcUo_TcNKK_aY9kAcq4uhA63y4Bh_byP2F8i2GkwKcxxcL2R6nojn63AzuMLy1372sZMY&indpubnum=7697745275879740&atk=1b6vd5cuhah7of0i","indeed_clk(this,'6750');","e362bd17e4e36fe2",FALSE,FALSE,FALSE,"Ciudad de México, D. F.","hace 8 días","","unknown","unknown","USD",NA,NA
"123",2,"actuaria","","",TRUE,TRUE,421,101,125,4,"Ingeniero de Pruebas No funcionales","SOLUCIONES KABEC","","","MX","México","bumeran.com.mx","Mon, 02 Jan 2017 18:01:33 GMT","Kabec, Empresa de T.I. con más de 17 años en el mercado solicita Ingeniero de Pruebas No funcionales Requisitos: • Escolaridad: Ing. de Sistemas, Ing. en...","http://www.indeed.com.mx/viewjob?jk=14116b2716640101&qd=bi1irCVCGq9473EJ9E79kxCEXhjIMzb7lFAuRtDcUo_TcNKK_aY9kAcq4uhA63y4Bh_byP2F8i2GkwKcxxcL2R6nojn63AzuMLy1372sZMY&indpubnum=7697745275879740&atk=1b6vd5cuhah7of0i","indeed_clk(this,'6750');","14116b2716640101",FALSE,FALSE,FALSE,"México","hace 18 días","","unknown","unknown","USD",NA,NA
"124",2,"actuaria","","",TRUE,TRUE,421,101,125,4,"Analista Financiero - Empresa transnacional","Page Personnel México","","","MX","México","Page Personnel México","Tue, 06 Dec 2016 06:50:43 GMT","Licenciatura en Finanzas, <b>Actuaría</b>, Economía, Contaduría Pública o carrera afín. Las principales responsabilidades son:....","http://www.indeed.com.mx/viewjob?jk=32b872c5055940bb&qd=bi1irCVCGq9473EJ9E79kxCEXhjIMzb7lFAuRtDcUo_TcNKK_aY9kAcq4uhA63y4Bh_byP2F8i2GkwKcxxcL2R6nojn63AzuMLy1372sZMY&indpubnum=7697745275879740&atk=1b6vd5cuhah7of0i","indeed_clk(this,'6750');","32b872c5055940bb",FALSE,FALSE,FALSE,"México","hace 30+ días","","unknown","unknown","USD",40000,45000
"125",2,"actuaria","","",TRUE,TRUE,421,101,125,4,"Coordinación Revenue Management","PepsiCo","","","MX","México","PepsiCo","Sat, 14 Jan 2017 09:37:18 GMT","<b>Actuaria</b>, Matemáticas o Economía. ¿Te gustaría pertenecer a una de las empresas de alimentos más grande a nivel global?...","http://www.indeed.com.mx/viewjob?jk=02a0d1af49bc4ab9&qd=bi1irCVCGq9473EJ9E79kxCEXhjIMzb7lFAuRtDcUo_TcNKK_aY9kAcq4uhA63y4Bh_byP2F8i2GkwKcxxcL2R6nojn63AzuMLy1372sZMY&indpubnum=7697745275879740&atk=1b6vd5cuhah7of0i","indeed_clk(this,'6750');","02a0d1af49bc4ab9",FALSE,FALSE,FALSE,"México","hace 6 días","","unknown","unknown","USD",NA,NA
"126",2,"actuaria","","",TRUE,TRUE,421,126,150,5,"Supervisor Casa Tec","Sorteos Tec","Monterrey","NLE","MX","Monterrey, N. L.","Elnorte.com","Fri, 13 Jan 2017 02:48:29 GMT","Licenciado en Ciencias de la Familia,Licenciado en Criminología,Fitotecnia,Ingeniero en Audio,Aviación,Contabilidad Financiera y Fiscal,Ingeniero Físico...","http://www.indeed.com.mx/viewjob?jk=250769bf0966f16e&qd=bi1irCVCGq9473EJ9E79kxCEXhjIMzb7lFAuRtDcUo_TcNKK_aY9kAcq4uhA63y4Bh_byP2F8i2GkwKcxxcL2R6nojn63AzuMLy1372sZMY&indpubnum=7697745275879740&atk=1b6vd5d30ah7ncov","indeed_clk(this,'6894');","250769bf0966f16e",FALSE,FALSE,FALSE,"Monterrey, N. L.","hace 7 días","","unknown","unknown","USD",13000,13000
"127",2,"actuaria","","",TRUE,TRUE,421,126,150,5,"Actuario","CARDIF","Ciudad de México","DIF","MX","Ciudad de México, D. F.","bumeran.com.mx","Thu, 22 Dec 2016 05:42:25 GMT","Licenciatura en <b>Actuaria</b>. 2 años en seguros de preferencia en cálculos de reservas técnicas, programación y automatización de procesos....","http://www.indeed.com.mx/viewjob?jk=dafcd2ac9114a541&qd=bi1irCVCGq9473EJ9E79kxCEXhjIMzb7lFAuRtDcUo_TcNKK_aY9kAcq4uhA63y4Bh_byP2F8i2GkwKcxxcL2R6nojn63AzuMLy1372sZMY&indpubnum=7697745275879740&atk=1b6vd5d30ah7ncov","indeed_clk(this,'6894');","dafcd2ac9114a541",FALSE,FALSE,FALSE,"Ciudad de México, D. F.","hace 29 días","","unknown","unknown","USD",NA,NA
"128",2,"actuaria","","",TRUE,TRUE,421,126,150,5,"COORDINADOR DE COMPENSACIONES Y BENEFICIOS","Pacific Star","Cuautitlán Izcalli","MEX","MX","Cuautitlán Izcalli, Méx.","bumeran.com.mx","Wed, 11 Jan 2017 18:22:17 GMT","Escolaridad: Lic. en Administracion, Actuaria, Ingenieria o carrera afín Edad; 28 a 35 años Ingles: intermedio-avanzado Experiencia en el área de...","http://www.indeed.com.mx/viewjob?jk=01d560e73d2a6c6d&qd=bi1irCVCGq9473EJ9E79kxCEXhjIMzb7lFAuRtDcUo_TcNKK_aY9kAcq4uhA63y4Bh_byP2F8i2GkwKcxxcL2R6nojn63AzuMLy1372sZMY&indpubnum=7697745275879740&atk=1b6vd5d30ah7ncov","indeed_clk(this,'6894');","01d560e73d2a6c6d",FALSE,FALSE,FALSE,"Cuautitlán Izcalli, Méx.","hace 9 días","","unknown","unknown","USD",NA,NA
"129",2,"actuaria","","",TRUE,TRUE,421,126,150,5,"Gerente De Marketing Digital","Grupo AXO","Ciudad de México","DIF","MX","Ciudad de México, D. F.","Trabajos.com","Thu, 19 Jan 2017 01:36:26 GMT","Licenciatura en Marketing, <b>Actuaria</b> o afín. Ver apartado funciones a desarrollar....","http://www.indeed.com.mx/viewjob?jk=643e4a1a59bdedc2&qd=bi1irCVCGq9473EJ9E79kxCEXhjIMzb7lFAuRtDcUo_TcNKK_aY9kAcq4uhA63y4Bh_byP2F8i2GkwKcxxcL2R6nojn63AzuMLy1372sZMY&indpubnum=7697745275879740&atk=1b6vd5d30ah7ncov","indeed_clk(this,'6894');","643e4a1a59bdedc2",FALSE,FALSE,FALSE,"Ciudad de México, D. F.","hace 2 días","","unknown","unknown","USD",NA,NA
"130",2,"actuaria","","",TRUE,TRUE,421,126,150,5,"Consultor BI y Data Science","Michael Page","Ciudad de México","DIF","MX","Ciudad de México, D. F.","Michael Page","Mon, 16 Jan 2017 11:47:42 GMT","Ingeniería en Ciencias de computación, en sistemas, <b>Actuaria</b>, con titulo. Empresa farmacéutica global....","http://www.indeed.com.mx/viewjob?jk=973b9460fe714472&qd=bi1irCVCGq9473EJ9E79kxCEXhjIMzb7lFAuRtDcUo_TcNKK_aY9kAcq4uhA63y4Bh_byP2F8i2GkwKcxxcL2R6nojn63AzuMLy1372sZMY&indpubnum=7697745275879740&atk=1b6vd5d30ah7ncov","indeed_clk(this,'6894');","973b9460fe714472",FALSE,FALSE,FALSE,"Ciudad de México, D. F.","hace 4 días","","unknown","unknown","USD",60000,70000
"131",2,"actuaria","","",TRUE,TRUE,421,126,150,5,"COORDINADOR DE COMPENSACIONES Y BENEFICIOS Y RECURSOS HUMANOS","CONAGRA FOODS","Ciudad de México","DIF","MX","Ciudad de México, D. F.","bumeran.com.mx","Wed, 04 Jan 2017 18:04:07 GMT","Licenciatura Administración de Empresas/ <b>Actuaría</b>/ Ingeniería Industrial o afín terminada. Mínimo 2 años de experiencia en el área de Compensaciones y...","http://www.indeed.com.mx/viewjob?jk=87f7935f155e0749&qd=bi1irCVCGq9473EJ9E79kxCEXhjIMzb7lFAuRtDcUo_TcNKK_aY9kAcq4uhA63y4Bh_byP2F8i2GkwKcxxcL2R6nojn63AzuMLy1372sZMY&indpubnum=7697745275879740&atk=1b6vd5d30ah7ncov","indeed_clk(this,'6894');","87f7935f155e0749",FALSE,FALSE,FALSE,"Ciudad de México, D. F.","hace 16 días","","unknown","unknown","USD",NA,NA
"132",2,"actuaria","","",TRUE,TRUE,421,126,150,5,"ANALISTA DE GASTOS (CORPORATIVO)","Price Shoes","Ciudad de México","DIF","MX","Ciudad de México, D. F.","Unidep","Tue, 22 Nov 2016 21:43:49 GMT","Industrial, Administración Industrial, Relaciones Industriales, <b>Actuaría</b>, Finanzas, Relaciones comerciales, Negocios, Administración (Pasante / Titulado ) ***....","http://www.indeed.com.mx/viewjob?jk=655a5fb004811361&qd=bi1irCVCGq9473EJ9E79kxCEXhjIMzb7lFAuRtDcUo_TcNKK_aY9kAcq4uhA63y4Bh_byP2F8i2GkwKcxxcL2R6nojn63AzuMLy1372sZMY&indpubnum=7697745275879740&atk=1b6vd5d30ah7ncov","indeed_clk(this,'6894');","655a5fb004811361",FALSE,FALSE,FALSE,"Ciudad de México, D. F.","hace 30+ días","","unknown","unknown","USD",10000,10000
"133",2,"actuaria","","",TRUE,TRUE,421,126,150,5,"Becario Revenue Managment","Grupo Posadas","Ciudad de México","DIF","MX","Ciudad de México, D. F.","bumeran.com.mx","Fri, 20 Jan 2017 18:44:05 GMT","Grupo POSADAS, solicita un Becario de Revenue Managment que se integre a su equipo de trabajo que cumpla con los siguientes requisitos: REQUISITOS:","http://www.indeed.com.mx/viewjob?jk=7e7af62b50808c71&qd=bi1irCVCGq9473EJ9E79kxCEXhjIMzb7lFAuRtDcUo_TcNKK_aY9kAcq4uhA63y4Bh_byP2F8i2GkwKcxxcL2R6nojn63AzuMLy1372sZMY&indpubnum=7697745275879740&atk=1b6vd5d30ah7ncov","indeed_clk(this,'6894');","7e7af62b50808c71",FALSE,FALSE,FALSE,"Ciudad de México, D. F.","hace 7 horas","","unknown","unknown","USD",NA,NA
"134",2,"actuaria","","",TRUE,TRUE,421,126,150,5,"TÉCNICO AUTOS","INTERPROTECCION","Miguel Hidalgo","DIF","MX","Miguel Hidalgo, D. F.","bumeran.com.mx","Fri, 23 Dec 2016 17:44:50 GMT","Licenciatura en <b>Actuaria</b>. Importante empresa líder en corretaje de Seguros, Fianzas y Reaseguro se encuentra en búsqueda de talento:....","http://www.indeed.com.mx/viewjob?jk=f46e8d7105a9acf2&qd=bi1irCVCGq9473EJ9E79kxCEXhjIMzb7lFAuRtDcUo_TcNKK_aY9kAcq4uhA63y4Bh_byP2F8i2GkwKcxxcL2R6nojn63AzuMLy1372sZMY&indpubnum=7697745275879740&atk=1b6vd5d30ah7ncov","indeed_clk(this,'6894');","f46e8d7105a9acf2",FALSE,FALSE,FALSE,"Miguel Hidalgo, D. F.","hace 28 días","","unknown","unknown","USD",NA,NA
"135",2,"actuaria","","",TRUE,TRUE,421,126,150,5,"“ESPECIALISTA EN MANEJO DE INFORMACIÓN”","DCH KNOW WHO","Ciudad de México","DIF","MX","Ciudad de México, D. F.","bumeran.com.mx","Thu, 29 Dec 2016 17:56:47 GMT","Licenciatura en <b>Actuaría</b>, Administración de Empresas, Ingenierías o relacionadas con perfil analítico . Orientación al Cliente Interno (Dirección de Datos /...","http://www.indeed.com.mx/viewjob?jk=23eaab08817fa79e&qd=bi1irCVCGq9473EJ9E79kxCEXhjIMzb7lFAuRtDcUo_TcNKK_aY9kAcq4uhA63y4Bh_byP2F8i2GkwKcxxcL2R6nojn63AzuMLy1372sZMY&indpubnum=7697745275879740&atk=1b6vd5d30ah7ncov","indeed_clk(this,'6894');","23eaab08817fa79e",FALSE,FALSE,FALSE,"Ciudad de México, D. F.","hace 22 días","","unknown","unknown","USD",NA,NA
"136",2,"actuaria","","",TRUE,TRUE,421,126,150,5,"Analista de información recursos humanos (Nóminas)","ELEKTRA","Ciudad de México","DIF","MX","Ciudad de México, D. F.","bumeran.com.mx","Sun, 01 Jan 2017 06:00:37 GMT","Administrador, Ingeniero industrial, Contador, Matemáticas, <b>Actuario</b> (Titulado). IMPORTANTE CORPORATIVO ESTA EN BUSQUEDA DE TALENTO CLAVE CON LAS SIGIENTES...","http://www.indeed.com.mx/viewjob?jk=77fb546a0cd37b41&qd=bi1irCVCGq9473EJ9E79kxCEXhjIMzb7lFAuRtDcUo_TcNKK_aY9kAcq4uhA63y4Bh_byP2F8i2GkwKcxxcL2R6nojn63AzuMLy1372sZMY&indpubnum=7697745275879740&atk=1b6vd5d30ah7ncov","indeed_clk(this,'6894');","77fb546a0cd37b41",FALSE,FALSE,FALSE,"Ciudad de México, D. F.","hace 19 días","","unknown","unknown","USD",30000,35000
"137",2,"actuaria","","",TRUE,TRUE,421,126,150,5,"ACTUARIO BILINGUE","C&E Personnel Administration","Miguel Hidalgo","DIF","MX","Miguel Hidalgo, D. F.","bumeran.com.mx","Wed, 21 Dec 2016 17:41:23 GMT","IMPORTANTE EMPRESA EN SU RAMO SOLICITA: ACTUARIO TEMPORAL *EXPERIENCIA EN PROGRAMACIÓN SQL/SAS *EXPLOTACION EN BASE DE DATOS *INGLES INTERMEDIO-AVANZADO *QUE","http://www.indeed.com.mx/viewjob?jk=04027df44f6323b4&qd=bi1irCVCGq9473EJ9E79kxCEXhjIMzb7lFAuRtDcUo_TcNKK_aY9kAcq4uhA63y4Bh_byP2F8i2GkwKcxxcL2R6nojn63AzuMLy1372sZMY&indpubnum=7697745275879740&atk=1b6vd5d30ah7ncov","indeed_clk(this,'6894');","04027df44f6323b4",FALSE,FALSE,FALSE,"Miguel Hidalgo, D. F.","hace 30 días","","unknown","unknown","USD",20000,20000
"138",2,"actuaria","","",TRUE,TRUE,421,126,150,5,"Becario ACTUARÍA (SOLO Estudiantes)","Daimler México","Ciudad de México","DIF","MX","Ciudad de México, D. F.","bumeran.com.mx","Tue, 17 Jan 2017 06:22:23 GMT","DAIMLER , empresa líder en el sector automotriz busca talento para incorporarse al área de Desarrollo a Distribuidores. REQUISITOS: * Estudiante ACTIVO *","http://www.indeed.com.mx/viewjob?jk=e5dcc626c8348c74&qd=bi1irCVCGq9473EJ9E79kxCEXhjIMzb7lFAuRtDcUo_TcNKK_aY9kAcq4uhA63y4Bh_byP2F8i2GkwKcxxcL2R6nojn63AzuMLy1372sZMY&indpubnum=7697745275879740&atk=1b6vd5d30ah7ncov","indeed_clk(this,'6894');","e5dcc626c8348c74",FALSE,FALSE,FALSE,"Ciudad de México, D. F.","hace 3 días","","unknown","unknown","USD",NA,NA
"139",2,"actuaria","","",TRUE,TRUE,421,126,150,5,"Gerente de Compensaciones","","Ciudad de México","DIF","MX","Ciudad de México, D. F.","bumeran.com.mx","Thu, 12 Jan 2017 06:16:57 GMT","En Administración, <b>Actuaría</b>, Ing. Empresa líder en su ramo por motivos de expansión solicita:....","http://www.indeed.com.mx/viewjob?jk=9113d258361fbd15&qd=bi1irCVCGq9473EJ9E79kxCEXhjIMzb7lFAuRtDcUo_TcNKK_aY9kAcq4uhA63y4Bh_byP2F8i2GkwKcxxcL2R6nojn63AzuMLy1372sZMY&indpubnum=7697745275879740&atk=1b6vd5d30ah7ncov","indeed_clk(this,'6894');","9113d258361fbd15",FALSE,FALSE,FALSE,"Ciudad de México, D. F.","hace 8 días","","unknown","unknown","USD",NA,NA
"140",2,"actuaria","","",TRUE,TRUE,421,126,150,5,"CONSULTOR DE PREVENCION DE LAVADO DE DINERO","Enlace Laboral","Ciudad de México","DIF","MX","Ciudad de México, D. F.","Enlace Laboral","Tue, 22 Nov 2016 21:14:53 GMT","Licenciatura en derecho, áreas administrativas, financieras, <b>actuarias</b> o afines. Excelente oportunidad para integrarte a una empresa con valores que nos...","http://www.indeed.com.mx/viewjob?jk=935de1aaa401db97&qd=bi1irCVCGq9473EJ9E79kxCEXhjIMzb7lFAuRtDcUo_TcNKK_aY9kAcq4uhA63y4Bh_byP2F8i2GkwKcxxcL2R6nojn63AzuMLy1372sZMY&indpubnum=7697745275879740&atk=1b6vd5d30ah7ncov","indeed_clk(this,'6894');","935de1aaa401db97",FALSE,FALSE,FALSE,"Ciudad de México, D. F.","hace 30+ días","","unknown","unknown","USD",19000,19000
"141",2,"actuaria","","",TRUE,TRUE,421,126,150,5,"CUSTOMER EXPERIENCE","Enlace Laboral","Ciudad de México","DIF","MX","Ciudad de México, D. F.","Enlace Laboral","Tue, 22 Nov 2016 09:12:37 GMT","Licenciatura en <b>Actuaría</b>, Ingeniería Industrial o afín. Empresa líder en el ramo de Telecomunicaciones móviles solicita....","http://www.indeed.com.mx/viewjob?jk=8c356609cbd60fe4&qd=bi1irCVCGq9473EJ9E79kxCEXhjIMzb7lFAuRtDcUo_TcNKK_aY9kAcq4uhA63y4Bh_byP2F8i2GkwKcxxcL2R6nojn63AzuMLy1372sZMY&indpubnum=7697745275879740&atk=1b6vd5d30ah7ncov","indeed_clk(this,'6894');","8c356609cbd60fe4",FALSE,FALSE,FALSE,"Ciudad de México, D. F.","hace 30+ días","","unknown","unknown","USD",25000,25000
"142",2,"actuaria","","",TRUE,TRUE,421,126,150,5,"DATA MINER BIMBO","Enlace Laboral","Ciudad de México","DIF","MX","Ciudad de México, D. F.","Enlace Laboral","Tue, 22 Nov 2016 09:02:24 GMT","<b>Actuaria</b>, Matemáticas aplicadas, Economía, Finanzas. EN GRUPO BIMBO TE INVITAMOS A PARTICIPAR EN SU PROCESO DE SELECCIÓN PARA:....","http://www.indeed.com.mx/viewjob?jk=0db313dbd06d35ad&qd=bi1irCVCGq9473EJ9E79kxCEXhjIMzb7lFAuRtDcUo_TcNKK_aY9kAcq4uhA63y4Bh_byP2F8i2GkwKcxxcL2R6nojn63AzuMLy1372sZMY&indpubnum=7697745275879740&atk=1b6vd5d30ah7ncov","indeed_clk(this,'6894');","0db313dbd06d35ad",FALSE,FALSE,FALSE,"Ciudad de México, D. F.","hace 30+ días","","unknown","unknown","USD",21000,24000
"143",2,"actuaria","","",TRUE,TRUE,421,126,150,5,"GERENTE DE PRESUPUESTOS","Enlace Laboral","Ciudad de México","DIF","MX","Ciudad de México, D. F.","Enlace Laboral","Wed, 23 Nov 2016 03:19:04 GMT","Ingeniero Industrial, LAE, <b>Actuario</b>, etc. Empresa número uno en Investigación de Mercados solicita:....","http://www.indeed.com.mx/viewjob?jk=f7a0d6a3db5e5bd2&qd=bi1irCVCGq9473EJ9E79kxCEXhjIMzb7lFAuRtDcUo_TcNKK_aY9kAcq4uhA63y4Bh_byP2F8i2GkwKcxxcL2R6nojn63AzuMLy1372sZMY&indpubnum=7697745275879740&atk=1b6vd5d30ah7ncov","indeed_clk(this,'6894');","f7a0d6a3db5e5bd2",FALSE,FALSE,FALSE,"Ciudad de México, D. F.","hace 30+ días","","unknown","unknown","USD",40000,40000
"144",2,"actuaria","","",TRUE,TRUE,421,126,150,5,"Coordinador de Producto","amedirh","Miguel Hidalgo","DIF","MX","Miguel Hidalgo, D. F.","amedirh","Thu, 12 Jan 2017 00:50:43 GMT","Administración de Empresas, <b>Actuaría</b>, Mercadotecnia o a fin. Importante Empresa Bancaria en Crecimiento....","http://www.indeed.com.mx/viewjob?jk=153be24d92a43728&qd=bi1irCVCGq9473EJ9E79kxCEXhjIMzb7lFAuRtDcUo_TcNKK_aY9kAcq4uhA63y4Bh_byP2F8i2GkwKcxxcL2R6nojn63AzuMLy1372sZMY&indpubnum=7697745275879740&atk=1b6vd5d30ah7ncov","indeed_clk(this,'6894');","153be24d92a43728",FALSE,FALSE,FALSE,"Miguel Hidalgo, D. F.","hace 9 días","","unknown","unknown","USD",36000,43000
